{
  "id": "019b4a3c-ce4c-779a-be18-22eb1771ee69",
  "route_number": "R783",
  "name": "Panacan via Angliongto to Roxas",
  "area": "Panacan",
  "time_period": "AM",
  "color": "#d98346",
  "start_time": "06:00",
  "end_time": "10:00",
  "points": [
    {
      "id": "019b54ee-670e-7035-bf4e-05bc39111abe",
      "name": "Panacan Depot Station",
      "latitude": 7.148352496779623,
      "longitude": 125.65923616688303,
      "kind": "stop"
    },
    {
      "id": "d85535da-458a-4ce5-89a4-718a55e079ad",
      "name": "",
      "latitude": 7.147359965819818,
      "longitude": 125.65831096458933,
      "kind": "waypoint"
    },
    {
      "id": "d95d749a-e3b3-452c-9c0f-e302ecf1a6cf",
      "name": "",
      "latitude": 7.146467039424242,
      "longitude": 125.6573010427096,
      "kind": "waypoint"
    },
    {
      "id": "a76a12ec-c914-454d-85ad-d7fc67b1d40e",
      "name": "",
      "latitude": 7.145531030849405,
      "longitude": 125.65632203236278,
      "kind": "waypoint"
    },
    {
      "id": "0485380f-25d0-41b6-b94f-26bc86d5bd2c",
      "name": "",
      "latitude": 7.144596034536079,
      "longitude": 125.65534203622666,
      "kind": "waypoint"
    },
    {
      "id": "019b54ee-670f-7359-bc87-368072835c49",
      "name": "Panacan Bypass Road Station",
      "latitude": 7.1437501392288425,
      "longitude": 125.65436664109302,
      "kind": "stop"
    },
    {
      "id": "6a952894-2ca7-42bd-b94f-50f361dfbed7",
      "name": "",
      "latitude": 7.1427699970881555,
      "longitude": 125.653430996885,
      "kind": "waypoint"
    },
    {
      "id": "782d0fe2-a374-4aeb-b967-c032eab63963",
      "name": "",
      "latitude": 7.141835007458021,
      "longitude": 125.65245100772923,
      "kind": "waypoint"
    },
    {
      "id": "2a0a61af-6db0-437e-ab51-f9a347ee3aa7",
      "name": "",
      "latitude": 7.140903068692138,
      "longitude": 125.65146807230751,
      "kind": "waypoint"
    },
    {
      "id": "b342a5f8-eb0d-44ae-a764-0149153e3594",
      "name": "",
      "latitude": 7.139973165820756,
      "longitude": 125.65048317575629,
      "kind": "waypoint"
    },
    {
      "id": "20533c5e-062b-4ceb-9f68-e8772df84553",
      "name": "",
      "latitude": 7.13904277462416,
      "longitude": 125.64949875984543,
      "kind": "waypoint"
    },
    {
      "id": "70f13b14-695e-4281-a3d4-53cb6cfad114",
      "name": "",
      "latitude": 7.138111855910709,
      "longitude": 125.64851484895735,
      "kind": "waypoint"
    },
    {
      "id": "25b1ffc6-d97b-4dfd-8ab4-57bf5dd80f55",
      "name": "",
      "latitude": 7.1371840221125735,
      "longitude": 125.64752802391895,
      "kind": "waypoint"
    },
    {
      "id": "019b54ee-6710-7d36-bb5c-31560024d87c",
      "name": "LPU Davao Station",
      "latitude": 7.136829103550468,
      "longitude": 125.64709777908456,
      "kind": "stop"
    },
    {
      "id": "67dda88d-8e7f-4c8b-97a5-8935483698f4",
      "name": "",
      "latitude": 7.135869576833866,
      "longitude": 125.64614156869605,
      "kind": "waypoint"
    },
    {
      "id": "ce16fb76-6e65-47a6-a45f-f08bdd6333eb",
      "name": "",
      "latitude": 7.134933081176971,
      "longitude": 125.64516308407615,
      "kind": "waypoint"
    },
    {
      "id": "0116df58-bf89-4e25-b10a-e09dad44bb0c",
      "name": "",
      "latitude": 7.133997640844548,
      "longitude": 125.64418362534143,
      "kind": "waypoint"
    },
    {
      "id": "92855dff-205c-418c-9692-dd8f026cfca1",
      "name": "",
      "latitude": 7.133076040044988,
      "longitude": 125.6431910436311,
      "kind": "waypoint"
    },
    {
      "id": "019b54ee-6711-7922-91a8-fe605d585904",
      "name": "Sta. Lucia Mall Station",
      "latitude": 7.132809965278199,
      "longitude": 125.64279798498205,
      "kind": "stop"
    },
    {
      "id": "a3ab29f9-6e3c-4a46-9da4-4c05e83a3ae7",
      "name": "",
      "latitude": 7.13189314157194,
      "longitude": 125.64180319820072,
      "kind": "waypoint"
    },
    {
      "id": "dd506f50-0108-4a34-ac24-60563b3e651e",
      "name": "",
      "latitude": 7.131079759166644,
      "longitude": 125.64071867888886,
      "kind": "waypoint"
    },
    {
      "id": "2b192582-1f21-43b5-b332-068289597837",
      "name": "",
      "latitude": 7.13024493152079,
      "longitude": 125.63965090993496,
      "kind": "waypoint"
    },
    {
      "id": "068bb897-2370-4c30-b0bb-6a68258f88b3",
      "name": "",
      "latitude": 7.129425181238188,
      "longitude": 125.63857123511981,
      "kind": "waypoint"
    },
    {
      "id": "14b5fac5-ac1e-475d-b434-a4c3d658f3ca",
      "name": "",
      "latitude": 7.128596429819329,
      "longitude": 125.63749855623678,
      "kind": "waypoint"
    },
    {
      "id": "8e23adc6-c304-43d7-8975-23a0201d8dbe",
      "name": "",
      "latitude": 7.127767828516793,
      "longitude": 125.63642577995518,
      "kind": "waypoint"
    },
    {
      "id": "79e65207-a694-4c5d-ad27-e505d77ee454",
      "name": "",
      "latitude": 7.126937983498735,
      "longitude": 125.63535397841233,
      "kind": "waypoint"
    },
    {
      "id": "85cf0a0d-b82f-47fa-a28d-f051d623b779",
      "name": "",
      "latitude": 7.126104896495341,
      "longitude": 125.63428486751404,
      "kind": "waypoint"
    },
    {
      "id": "019b54ee-6712-7785-abbd-49b3617f08d9",
      "name": "McDonald's Pagibig Station",
      "latitude": 7.125931685167998,
      "longitude": 125.63392313825193,
      "kind": "stop"
    },
    {
      "id": "3f562215-0464-4588-a833-e996d6d09215",
      "name": "",
      "latitude": 7.124998811288493,
      "longitude": 125.63293478857322,
      "kind": "waypoint"
    },
    {
      "id": "46d5d0b1-ba5a-439c-b0ca-9162784429c1",
      "name": "",
      "latitude": 7.124031514349668,
      "longitude": 125.6319884629147,
      "kind": "waypoint"
    },
    {
      "id": "f0e7b5f2-b747-44bc-bf87-0824dd015b3c",
      "name": "",
      "latitude": 7.123083177653305,
      "longitude": 125.63203676312892,
      "kind": "waypoint"
    },
    {
      "id": "72cbbdef-8530-4ea9-a3a3-415b4fd81a36",
      "name": "",
      "latitude": 7.122082044762155,
      "longitude": 125.63293696790637,
      "kind": "waypoint"
    },
    {
      "id": "019b54ee-6713-7178-925c-23c0d93f7d8b",
      "name": "Punad Bypass Station",
      "latitude": 7.1219558280982085,
      "longitude": 125.63294497501374,
      "kind": "stop"
    },
    {
      "id": "17eea16d-8955-45fd-8845-efd18286d0ae",
      "name": "",
      "latitude": 7.120887856002038,
      "longitude": 125.63377809818043,
      "kind": "waypoint"
    },
    {
      "id": "0850b8e8-e941-493f-ac93-af3486b3bde4",
      "name": "",
      "latitude": 7.119776865479742,
      "longitude": 125.63363683632264,
      "kind": "waypoint"
    },
    {
      "id": "cc3bd0f8-0af8-4b1a-8c2d-194d84cd907a",
      "name": "",
      "latitude": 7.1188788193814165,
      "longitude": 125.63262279394218,
      "kind": "waypoint"
    },
    {
      "id": "2eff65cd-3ef2-411a-9062-ab48b60a9bc1",
      "name": "",
      "latitude": 7.118032933255343,
      "longitude": 125.63156490922727,
      "kind": "waypoint"
    },
    {
      "id": "ddc3edc2-e42c-41c5-b9d9-4b4e470745fe",
      "name": "",
      "latitude": 7.116809246833887,
      "longitude": 125.63139696282623,
      "kind": "waypoint"
    },
    {
      "id": "c8b6302e-5bbd-4668-b759-78caafb83d36",
      "name": "",
      "latitude": 7.115721801525236,
      "longitude": 125.63127017995045,
      "kind": "waypoint"
    },
    {
      "id": "00346b07-39d8-4b2f-a406-12cfdce70de7",
      "name": "",
      "latitude": 7.114477004705829,
      "longitude": 125.63170299852102,
      "kind": "waypoint"
    },
    {
      "id": "b384d2f8-5385-4181-8ad0-749caa8fcd61",
      "name": "",
      "latitude": 7.113200342002521,
      "longitude": 125.63214188725192,
      "kind": "waypoint"
    },
    {
      "id": "8d6ac95a-1bc9-49a5-89d8-3456e43b4aaa",
      "name": "",
      "latitude": 7.111881159404951,
      "longitude": 125.63228502656749,
      "kind": "waypoint"
    },
    {
      "id": "c1c7291d-a3c0-4f0d-a10d-ad9561f687de",
      "name": "",
      "latitude": 7.110544060064209,
      "longitude": 125.63227199737425,
      "kind": "waypoint"
    },
    {
      "id": "88aff30a-635b-403b-9faf-f277587dc364",
      "name": "",
      "latitude": 7.109197954688312,
      "longitude": 125.63236000503464,
      "kind": "waypoint"
    },
    {
      "id": "019b54ee-6714-7eb5-b23b-d1de6026133f",
      "name": "Angliongto Arcade Station",
      "latitude": 7.108804137203279,
      "longitude": 125.63232702960931,
      "kind": "stop"
    },
    {
      "id": "1bfd5f71-04f2-4c15-bcb3-6ed427293580",
      "name": "",
      "latitude": 7.10746199043831,
      "longitude": 125.63247700043462,
      "kind": "waypoint"
    },
    {
      "id": "2775ac6e-d87d-40e8-b7e0-eb44bc2a525b",
      "name": "",
      "latitude": 7.106116765254876,
      "longitude": 125.63257702031449,
      "kind": "waypoint"
    },
    {
      "id": "e63678c8-a80f-414b-a401-a12a73806d78",
      "name": "",
      "latitude": 7.104770837994654,
      "longitude": 125.6326670113027,
      "kind": "waypoint"
    },
    {
      "id": "2a01d589-9d30-4bf9-8527-2f486a470d76",
      "name": "",
      "latitude": 7.103424645635686,
      "longitude": 125.63275402271567,
      "kind": "waypoint"
    },
    {
      "id": "019b54ee-6715-75f6-8edf-73a590978357",
      "name": "Philippine Nikkei Jin Kai Station",
      "latitude": 7.102756091613799,
      "longitude": 125.63273687284595,
      "kind": "stop"
    },
    {
      "id": "f63d16dc-5855-4269-91d1-c7e61e1ef198",
      "name": "",
      "latitude": 7.10141379320782,
      "longitude": 125.6328950193006,
      "kind": "waypoint"
    },
    {
      "id": "111b3c5b-5a21-4374-8b1b-caa80a4f0eb7",
      "name": "",
      "latitude": 7.100927906026709,
      "longitude": 125.63174967109349,
      "kind": "waypoint"
    },
    {